{
    "$schema": "http://json-schema.org/draft-07/schema#",
    "$id": "https://llama-gui/schemas/plugin.schema.json",
    "title": "Llama GUI Plugin Manifest",
    "description": "Schema for plugin.json files in the llama-gui plugin system (see docs/PLUGIN_SYSTEM.md)",
    
    "type": "object",
    "required": ["name", "version", "description", "api_version"],
    
    "properties": {
        "name": {
            "type": "string",
            "description": "Unique identifier for the plugin",
            "pattern": "^[a-z][a-z0-9_-]*$",
            "minLength": 2,
            "maxLength": 64,
            "examples": ["hello_plugin", "rag_agent", "file_explorer"]
        },
        
        "version": {
            "type": "string",
            "description": "Plugin version in semver format",
            "pattern": "^[0-9]+\\.[0-9]+\\.[0-9]+(-[a-zA-Z0-9]+)?$",
            "examples": ["1.0.0", "2.1.3-beta"]
        },
        
        "description": {
            "type": "string",
            "description": "Human-readable description of the plugin",
            "minLength": 5,
            "maxLength": 500,
            "examples": ["RAG-based document search plugin"]
        },
        
        "author": {
            "type": "string",
            "description": "Plugin author name",
            "maxLength": 256,
            "examples": ["llama-gui team", "John Doe <john@example.com>"]
        },
        
        "api_version": {
            "type": "string",
            "description": "Compatible plugin API version (must match the host)",
            "pattern": "^[0-9]+\\.[0-9]+\\.[0-9]+$",
            "examples": ["1.0.0"]
        },
        
        "library": {
            "type": "string",
            "description": "Filename of the plugin library (informational)",
            "pattern": "^lib?[a-zA-Z0-9_-]+\\.(so|dll|dylib)$",
            "examples": ["libhello_plugin.so", "file_agent.dll"]
        },
        
        "permissions": {
            "type": "array",
            "description": "Permissions requested by the plugin (currently informational, not enforced)",
            "items": {
                "type": "string",
                "enum": [
                    "chat_access",
                    "llm_access",
                    "rag_access",
                    "embedding",
                    "filesystem_read",
                    "filesystem_write",
                    "network",
                    "execution"
                ]
            },
            "examples": [["rag_access", "chat_access"], ["llm_access"]]
        },
        
        "capabilities": {
            "type": "array",
            "description": "List of capabilities provided by the plugin",
            "items": {
                "type": "string",
                "examples": ["document_search", "code_generation", "ui_window"]
            }
        },
        
        "homepage": {
            "type": "string",
            "description": "URL to plugin homepage or repository",
            "format": "uri",
            "examples": ["https://github.com/user/my-plugin"]
        },
        
        "license": {
            "type": "string",
            "description": "SPDX license identifier",
            "examples": ["MIT", "Apache-2.0", "GPL-3.0"]
        },
        
        "tags": {
            "type": "array",
            "description": "List of tags for categorization",
            "items": {
                "type": "string"
            },
            "examples": [["search", "rag", "documents"]]
        },
        
        "min_llama_gui_version": {
            "type": "string",
            "description": "Minimum required llama-gui version",
            "pattern": "^[0-9]+\\.[0-9]+\\.[0-9]+$",
            "examples": ["0.1.60"]
        },
        
        "platforms": {
            "type": "array",
            "description": "Supported platforms",
            "items": {
                "type": "string",
                "enum": ["linux", "windows", "macos"]
            }
        }
    },
    
    "additionalProperties": false
}
