{
    "name": "wp_coder",
    "version": "0.13.0",
    "description": "AI-кодер с модульной архитектурой: WordPress, Python, DevOps",
    "author": "llama-gui",
    "api_version": "1.0.0",
    "permissions": ["rag_access", "llm_access", "chat_access", "filesystem_read", "filesystem_write", "execution", "network"],
    "capabilities": ["code_generation", "wordpress", "python", "devops", "rag", "ui_window", "agent", "modules"],
    "min_llama_gui_version": "0.1.60",
    "platforms": ["linux", "windows", "macos"]
}
